{"schema":"contrepoint/instantane/1","contrat":"0.3.0","id":"an17-2026-07-21","chambre":"AN","legislature":"17","date":"2026-07-21","date_arretee":"2026-08-27T00:00:00Z","ancrage":{"famille":"votes","ancre_gauche":"groupe.an17.lfi-nfp","ancre_droite":"groupe.an17.rn","note":"Médiane du groupe LFI-NFP à −1,0000, médiane du groupe RN à +1,0000, au 2026-07-21."},"bandes":[{"id":"parti.lfi","libelle":"La France insoumise","marqueurs":[{"famille":"votes","echelle":"votes_an17_ancre_v1","valeur":-1.0000,"valeur_code":null,"libelle":"Votes du groupe LFI-NFP","motif_code":null,"motif":null,"dispersion":{"effectif":73,"iqr":0.0470},"preuve":"eeb1f40eb7400df6d5c043235058d9b1660919dffbde9baf80444056208a2399"},{"famille":"experts","echelle":"ches_lrgen_0_10","valeur":0.82,"valeur_code":null,"libelle":"CHES 2024, lrgen","motif_code":null,"motif":null,"dispersion":null,"preuve":"b844549a378929e4a223b0418fbe18c15dddd235b581fdc3282735a61c45420d"},{"famille":"administratif","echelle":"nuance_leg2024","valeur":null,"valeur_code":"FI","libelle":"Nuance 2024","motif_code":null,"motif":null,"dispersion":null,"preuve":"e4bdd63b17dfa5492a8ba548e090d8c22573ab9b9411c63da3bd3fe3bc02a65e"}]},{"id":"groupe.an17.ecos","libelle":"Écologiste et Social","marqueurs":[{"famille":"votes","echelle":"votes_an17_ancre_v1","valeur":-0.9876,"valeur_code":null,"libelle":"Votes du groupe ECOS","motif_code":null,"motif":null,"dispersion":{"effectif":38,"iqr":0.0330},"preuve":"4e59897894eccd1b5dded56ce85cf9b616a9ad4c6caf3a066c33cef10ddd72c4"}]},{"id":"groupe.an17.gdr","libelle":"Gauche Démocrate et Républicaine","marqueurs":[{"famille":"votes","echelle":"votes_an17_ancre_v1","valeur":-0.8619,"valeur_code":null,"libelle":"Votes du groupe GDR","motif_code":null,"motif":null,"dispersion":{"effectif":18,"iqr":0.0830},"preuve":"97b655b96be1d603c972dc6f5007e1cd96af740ddc307978355f41e95f0216b4"}]},{"id":"parti.ps","libelle":"Parti socialiste","marqueurs":[{"famille":"votes","echelle":"votes_an17_ancre_v1","valeur":-0.8352,"valeur_code":null,"libelle":"Votes du groupe SOC","motif_code":null,"motif":null,"dispersion":{"effectif":70,"iqr":0.0570},"preuve":"83ae42c1b456dd51bbe2b84aafeeefc498abb367308e936078574e2da28aeb4c"}]},{"id":"groupe.an17.dem","libelle":"Les Démocrates","marqueurs":[{"famille":"votes","echelle":"votes_an17_ancre_v1","valeur":0.1814,"valeur_code":null,"libelle":"Votes du groupe DEM","motif_code":null,"motif":null,"dispersion":{"effectif":41,"iqr":0.2050},"preuve":"de9a1b621eb7fb8fd1420601d7d9adb8d9202d3833498f0ba7f38b90ab722f97"}]},{"id":"groupe.an17.epr","libelle":"Ensemble pour la République","marqueurs":[{"famille":"votes","echelle":"votes_an17_ancre_v1","valeur":0.2408,"valeur_code":null,"libelle":"Votes du groupe EPR","motif_code":null,"motif":null,"dispersion":{"effectif":115,"iqr":0.2260},"preuve":"66a656fc0ca3935e7766cbe71d99b704bdffdd47a68fa1d320dcf466ff747031"}]},{"id":"parti.horizons","libelle":"Horizons","marqueurs":[{"famille":"votes","echelle":"votes_an17_ancre_v1","valeur":0.3837,"valeur_code":null,"libelle":"Votes du groupe HOR","motif_code":null,"motif":null,"dispersion":{"effectif":43,"iqr":0.2000},"preuve":"e28cc237a7cd1a0a64ab0dcf4d3208115db3b45764da4ebfccec5e09b89a9db4"}]},{"id":"parti.lr","libelle":"Les Républicains","marqueurs":[{"famille":"votes","echelle":"votes_an17_ancre_v1","valeur":0.7013,"valeur_code":null,"libelle":"Votes du groupe DR","motif_code":null,"motif":null,"dispersion":{"effectif":63,"iqr":0.1130},"preuve":"28de56420e52cc32374ca21fd0ed531188d1e6db6d0940117647e7e4d5bc7f41"}]},{"id":"parti.udr","libelle":"Union des droites pour la République","marqueurs":[{"famille":"votes","echelle":"votes_an17_ancre_v1","valeur":0.9900,"valeur_code":null,"libelle":"Votes du groupe UDDPLR","motif_code":null,"motif":null,"dispersion":{"effectif":18,"iqr":0.0420},"preuve":"72e8cfa33756f73ff1daa3b078d805908f98d1a332fba7beef3e714335ce3bde"}]},{"id":"parti.rn","libelle":"Rassemblement national","marqueurs":[{"famille":"votes","echelle":"votes_an17_ancre_v1","valeur":1.0000,"valeur_code":null,"libelle":"Votes du groupe RN","motif_code":null,"motif":null,"dispersion":{"effectif":129,"iqr":0.0520},"preuve":"dc892cc62cc092a64325167a81a1a1ced19d66c187cbacd41cb96ded5a640d0e"},{"famille":"experts","echelle":"ches_lrgen_0_10","valeur":8.82,"valeur_code":null,"libelle":"CHES 2024, lrgen","motif_code":null,"motif":null,"dispersion":null,"preuve":"301ba4f72eea71e81779cf2292e4ccf1b8d7925b5083323b49322265de8d5bf2"}]},{"id":"coalition.nfp","libelle":"Nouveau Front populaire","marqueurs":[{"famille":"administratif","echelle":"nuance_leg2024","valeur":null,"valeur_code":"UG","libelle":"Nuance 2024","motif_code":null,"motif":null,"dispersion":null,"preuve":"37a36fb45add51d0caaa5c415f662538f157dde780572dd7f9262fcb03b47267"}]},{"id":"groupe.an17.liot","libelle":"LIOT","marqueurs":[{"famille":"votes","echelle":"votes_an17_ancre_v1","valeur":null,"valeur_code":null,"libelle":"Votes du groupe LIOT","motif_code":"sous_seuil_de_publication","motif":"Dispersion interne au-delà du seuil publié : IQR 0,687 pour un maximum de 0,25.","dispersion":{"effectif":25,"iqr":0.6870},"preuve":"d9cae6ddde51b6ecac6e365fc1bb24e1d97ebcbb7d90eeb8ffe9e6bd8363bcef"}]},{"id":"groupe.an17.ni","libelle":"Non inscrit","marqueurs":[{"famille":"votes","echelle":"votes_an17_ancre_v1","valeur":null,"valeur_code":null,"libelle":"Votes du groupe NI","motif_code":"sous_seuil_de_publication","motif":"Dispersion interne au-delà du seuil publié : IQR 0,623 pour un maximum de 0,25, et effectif retenu 9 pour un minimum de 10.","dispersion":{"effectif":9,"iqr":0.6230},"preuve":"b8ff700476b1ba71e8e063c559e63b1033a83d4b11b44c53769ce58af62269d2"}]}],"sans_mesure":[{"entite":"parti.place-publique","libelle":"Place publique","motif_code":"hors_source","motif":"Entité absente des quatre sources d'identifiants et de la grille de nuances, au 2026-08-27."}]}
